<?xml version="1.0" encoding="UTF-8"?>

<xs:schema xmlns:xs="http://www.w3.org/2001/XMLSchema"
	 xmlns="http://www.tibco.com/schemas/bw/Blask/MimeTypes.xsd"
	 targetNamespace="http://www.tibco.com/schemas/bw/Blask/MimeTypes.xsd"
	 elementFormDefault="qualified"
	 attributeFormDefault="unqualified">
	<xs:element name="mimeTypes">
		<xs:complexType>
			<xs:sequence>
				<xs:element ref="mimeType" minOccurs="0" maxOccurs="unbounded"/>
			</xs:sequence>
		</xs:complexType>
	</xs:element>
	<xs:element name="mimeType">
		<xs:complexType>
			<xs:simpleContent>
				<xs:extension base="xs:string">
					<xs:attribute name="extension" type="xs:string"/>
				</xs:extension>
			</xs:simpleContent>
		</xs:complexType>
	</xs:element>
</xs:schema>